bare	accented	translations_en	translations_de	aspect	partner	imperative_sg	imperative_pl	past_m	past_f	past_n	past_pl	presfut_sg1	presfut_sg2	presfut_sg3	presfut_pl1	presfut_pl2	presfut_pl3
дожидаться	дожида'ться	wait, await	warten, abwarten, erwarten	imperfective	дождаться	дожида'йся	дожида'йтесь	дожида'лся	дожида'лась	дожида'лось	дожида'лись	дожида'юсь	дожида'ешься	дожида'ется	дожида'емся	дожида'етесь	дожида'ются
окружить	окружи'ть	surround, gather round, encircle, ring in, round up	umgeben, umringen, umzingeln, einkesseln	perfective	окружать	окружи'	окружи'те	окружи'л	окружи'ла	окружи'ло	окружи'ли	окружу'	окружи'шь	окружи'т	окружи'м	окружи'те	окружа'т
разглядеть	разгляде'ть	make out, discern, descry, perceive	erkennen, bemerken, mustern, besehen	perfective	разглядывать	разгляди'	разгляди'те	разгляде'л	разгляде'ла	разгляде'ло	разгляде'ли	разгляжу'	разгляди'шь	разгляди'т	разгляди'м	разгляди'те	разглядя'т
достаться	доста'ться	to get	zuteil werden, zukommen zufallen	perfective	доставаться	доста'нься	доста'ньтесь	доста'лся	доста'лась	доста'лось	доста'лись	доста'нусь	доста'нешься	доста'нется	доста'немся	доста'нетесь	доста'нутся
заглядывать	загля'дывать	peep in, glance, look in, drop in, call	vorbeikommen, vorbeischauen, hineingucken	imperfective	заглянуть	загля'дывай	загля'дывайте	загля'дывал	загля'дывала	загля'дывало	загля'дывали	загля'дываю	загля'дываешь	загля'дывает	загля'дываем	загля'дываете	загля'дывают
предпочитать	предпочита'ть	prefer	vorziehen, es für besser halten; bevorzugen	imperfective	предпочесть	предпочита'й	предпочита'йте	предпочита'л	предпочита'ла	предпочита'ло	предпочита'ли	предпочита'ю	предпочита'ешь	предпочита'ет	предпочита'ем	предпочита'ете	предпочита'ют
рваться	рва'ться	break, burst, tear, long, be dying, strain	reißen, verschleißen; nach etwas streben	imperfective	порваться,разорваться,изорваться,сорваться	рви'сь	рви'тесь	рва'лся	рвала'сь	рва'лось//рвало'сь	рва'лись//рвали'сь	рву'сь	рвёшься	рвётся	рвёмся	рвётесь	рву'тся
возражать	возража'ть	object, raise an objection, take exception, return, rejoin, retort	widersprechen, erwidern, entgegnen; einwenden	imperfective	возразить	возража'й	возража'йте	возража'л	возража'ла	возража'ло	возража'ли	возража'ю	возража'ешь	возража'ет	возража'ем	возража'ете	возража'ют
выставить	вы'ставить	put out, stick out, expose; kick out	ausstellen, zur Schau stellen, in Vordergrund rücken; aufstellen (auch: nominieren); hinausstellen (auch: hinauswerfen)	perfective	выставлять	вы'стави//вы'ставь	вы'ставьте	вы'ставил	вы'ставила	вы'ставило	вы'ставили	вы'ставлю	вы'ставишь	вы'ставит	вы'ставим	вы'ставите	вы'ставят
переживать	пережива'ть	be upset, worry; suffer, experience, go through, live through	erleben; überleben; sich beunruhigen, sich Sorgen machen	imperfective	пережить	пережива'й	пережива'йте	пережива'л	пережива'ла	пережива'ло	пережива'ли	пережива'ю	пережива'ешь	пережива'ет	пережива'ем	пережива'ете	пережива'ют
учесть	уче'сть	take into account, take into consideration, bear in mind	berücksichtigen, miteinbeziehen; einkalkulieren, zählen	perfective	учитывать	учти'	учти'те	учёл	учла'	учло'	учли'	учту'	учтёшь	учтёт	учтём	учтёте	учту'т
выразить	вы'разить	express, convey, voice, give voice	ausdrücken, zum Ausdruck bringen; äußern, aussprechen	perfective	выражать	вы'разь	вы'разьте	вы'разил	вы'разила	вы'разило	вы'разили	вы'ражу	вы'разишь	вы'разит	вы'разим	вы'разите	вы'разят
развиваться	развива'ться	develop, untwist, come uncurled, lose its curls	sich entwickeln, sich entfalten	imperfective	развиться	развива'йся	развива'йтесь	развива'лся	развива'лась	развива'лось	развива'лись	развива'юсь	развива'ешься	развива'ется	развива'емся	развива'етесь	развива'ются
подвести	подвести'	υπονομεύει bring, place, let down, do an ill, a bad, turn	im Stich lassen, enttäuschen; führen, herbeiführen, anführen; einordnen, einstufen	perfective	подводить	подведи'	подведи'те	подвёл	подвела'	подвело'	подвели'	подведу'	подведёшь	подведёт	подведём	подведёте	подведу'т
устроиться	устро'иться	get oneself, arrange onself	sich regeln, sich geben, in Ordnung kommen, sich einrichten, es sich bequem machen, unterkommen, Unterkunft finden, untergebracht werden, Unterkommen	perfective	устраиваться	устро'йся	устро'йтесь	устро'ился	устро'илась	устро'илось	устро'ились	устро'юсь	устро'ишься	устро'ится	устро'имся	устро'итесь	устро'ятся
командовать	кома'ндовать	give orders, command, be in command, order about	kommandieren, befehligen, leiten	imperfective	скомандовать	кома'ндуй	кома'ндуйте	кома'ндовал	кома'ндовала	кома'ндовало	кома'ндовали	кома'ндую	кома'ндуешь	кома'ндует	кома'ндуем	кома'ндуете	кома'ндуют
вздрогнуть	вздро'гнуть	start, give a start, flinch, wince, quiver, shudder	zusammenzucken, zusammenfahren, auffahren	perfective	вздрагивать	вздро'гни	вздро'гните	вздро'гнул	вздро'гнула	вздро'гнуло	вздро'гнули	вздро'гну	вздро'гнешь	вздро'гнет	вздро'гнем	вздро'гнете	вздро'гнут
запереть	запере'ть	lock, lock in, close up, bar, block up	abschließen, verschließen	perfective	запирать	запри'	запри'те	за'пер	заперла'	за'перло	за'перли	запру'	запрёшь	запрёт	запрём	запрёте	запру'т
разбираться	разбира'ться	manage, deal, come apart, unpack, investigate, examine, look, understand, gain an understanding, come to know the particulars	sich auskennen	imperfective	разобраться	разбира'йся	разбира'йтесь	разбира'лся	разбира'лась	разбира'лось	разбира'лись	разбира'юсь	разбира'ешься	разбира'ется	разбира'емся	разбира'етесь	разбира'ются
обмануть	обману'ть	deceive, cheat, trick, swindle	betrügen / täuschen (hintergehen), belügen, lügen über etw.; sein Versprechen nicht halten	perfective	обманывать	обмани'	обмани'те	обману'л	обману'ла	обману'ло	обману'ли	обману'	обма'нешь	обма'нет	обма'нем	обма'нете	обма'нут
владеть	владе'ть	own, have, possess, be master be in possession, be able to use, wield	besitzen, beherrschen, in der Gewalt haben	imperfective	завладеть	владе'й	владе'йте	владе'л	владе'ла	владе'ло	владе'ли	владе'ю	владе'ешь	владе'ет	владе'ем	владе'ете	владе'ют
отрезать	отре'зать	cut off, snip off, snap out, cut short	abschneiden, abtrennen, wegnehmen, kürzen; kurz und unwillig antworten; dreschen, verdreschen, vermöbeln, verkloppen; kuscheln, durchstrubbeln	perfective	отрезать	отреза'й	отреза'йте	отреза'л	отреза'ла	отреза'ло	отреза'ли	отреза'ю	отреза'ешь	отреза'ет	отреза'ем	отреза'ете	отреза'ют
родить	роди'ть	give birth, give rise, bear	gebären, zur Welt bringen, entbunden werden, erzeugen, hervorrufen	both	рожать	роди'	роди'те	роди'л	родила'	роди'ло	роди'ли	рожу'	роди'шь	роди'т	роди'м	роди'те	родя'т
рухнуть	ру'хнуть	crash down, tumble down, collapse, be destroyed, fall to the ground	einstürzen / einfallen; zusammenbrechen	perfective	рушиться	ру'хни	ру'хните	ру'хнул	ру'хнула	ру'хнуло	ру'хнули	ру'хну	ру'хнешь	ру'хнет	ру'хнем	ру'хнете	ру'хнут
провожать	провожа'ть	to escort, to accompany; see off, say goodbye	begleiten, bringen	imperfective	проводить	провожа'й	провожа'йте	провожа'л	провожа'ла	провожа'ло	провожа'ли	провожа'ю	провожа'ешь	провожа'ет	провожа'ем	провожа'ете	провожа'ют
осмотреть	осмотре'ть	examine, survey, view, scan, see, inspect	besichtigen, genau betrachten, in Augenschein nehmen; untersuchen (anschauen)	perfective	осматривать	осмотри'	осмотри'те	осмотре'л	осмотре'ла	осмотре'ло	осмотре'ли	осмотрю'	осмо'тришь	осмо'трит	осмо'трим	осмо'трите	осмо'трят
кончаться	конча'ться	end, finish, come to an end	enden, zu Ende gehen, ausgehen, aufhören	imperfective	кончиться	конча'йся	конча'йтесь	конча'лся	конча'лась	конча'лось	конча'лись	конча'юсь	конча'ешься	конча'ется	конча'емся	конча'етесь	конча'ются
уснуть	усну'ть	fall asleep	einschlafen	perfective	-	усни'	усни'те	усну'л	усну'ла	усну'ло	усну'ли	усну'	уснёшь	уснёт	уснём	уснёте	усну'т
оглядеть	огляде'ть	examine, look over	besehen, betrachten, überblicken	perfective	оглядывать	огляди'	огляди'те	огляде'л	огляде'ла	огляде'ло	огляде'ли	огляжу'	огляди'шь	огляди'т	огляди'м	огляди'те	оглядя'т
прятаться	пря'таться	hide, conceal oneself	sich verstecken, sich verbergen	imperfective	спрятаться	пря'чься	пря'чьтесь	пря'тался	пря'талась	пря'талось	пря'тались	пря'чусь	пря'чешься	пря'чется	пря'чемся	пря'четесь	пря'чутся
ранить	ра'нить	injure (hurt)	verwunden; verletzen, kränken	imperfective	поранить	ра'нь	ра'ньте	ра'нил	ра'нила	ра'нило	ра'нили	ра'ню	ра'нишь	ра'нит	ра'ним	ра'ните	ра'нят
открываться	открыва'ться	open, come to light, be revealed, confide	sich öffnen, aufgehen, geöffnet werden, eröffnet werden, beginnen	imperfective	открыться	открыва'йся	открыва'йтесь	открыва'лся	открыва'лась	открыва'лось	открыва'лись	открыва'юсь	открыва'ешься	открыва'ется	открыва'емся	открыва'етесь	открыва'ются
научить	научи'ть	teach	beibringen, lehren	perfective	учить	научи'	научи'те	научи'л	научи'ла	научи'ло	научи'ли	научу'	нау'чишь	нау'чит	нау'чим	нау'чите	нау'чат
подчеркнуть	подчеркну'ть	underline, underscore, emphasize, accentuate, stress	unterstreichen, betonen, hervorheben	perfective	подчёркивать	подчеркни'	подчеркни'те	подчеркну'л	подчеркну'ла	подчеркну'ло	подчеркну'ли	подчеркну'	подчеркнёшь	подчеркнёт	подчеркнём	подчеркнёте	подчеркну'т
успокоить	успоко'ить	calm, quiet, soothe, assuage, appease, reassure; calm down	beruhigen, beschwichtigen, zur Ruhe bringen	perfective	успокаивать	успоко'й	успоко'йте	успоко'ил	успоко'ила	успоко'ило	успоко'или	успоко'ю	успоко'ишь	успоко'ит	успоко'им	успоко'ите	успоко'ят
ломать	лома'ть	break, fracture, quarry	brechen, abbrechen, zerbrechen, zerschlagen, abreißen, niederreißen; kaputt machen	imperfective	сломать,поломать	лома'й	лома'йте	лома'л	лома'ла	лома'ло	лома'ли	лома'ю	лома'ешь	лома'ет	лома'ем	лома'ете	лома'ют
сбросить	сбро'сить	throw down, drop, throw off, shed	abwerfen, herunterwerfen, zusammenwerfen, ausziehen; schicken (über Internet)	perfective	сбрасывать	сбро'сь	сбро'сьте	сбро'сил	сбро'сила	сбро'сило	сбро'сили	сбро'шу	сбро'сишь	сбро'сит	сбро'сим	сбро'сите	сбро'сят
перенести	перенести'	postpone; reschedule	verschieben / verlegen (räumlich o. zeitlich), verlagern, vertagen, aufschieben, verschieben, übertragen; vertragen (ertragen), aushalten, erdulden, erleiden	perfective	переносить	перенеси'	перенеси'те	перенёс	перенесла'	перенесло'	перенесли'	перенесу'	перенесёшь	перенесёт	перенесём	перенесёте	перенесу'т
прятать	пря'тать	hide, conceal	verbergen, verstecken, verwahren	imperfective	спрятать	пря'чь	пря'чьте	пря'тал	пря'тала	пря'тало	пря'тали	пря'чу	пря'чешь	пря'чет	пря'чем	пря'чете	пря'чут
развернуть	разверну'ть	unroll, unwind, unfold, unwrap, show, display, develop, deploy, extend, expand, establish, set up, turn, slew	ausbreiten, entfalten, aufrollen, aufschlagen, aufmachen, auspacken, auswickeln, entwickeln, in Gang bringen, wenden	perfective	развёртывать,разворачивать	разверни'	разверни'те	разверну'л	разверну'ла	разверну'ло	разверну'ли	разверну'	развернёшь	развернёт	развернём	развернёте	разверну'т
засыпать	засы'пать	fill up, cover, engulf, overwhelm	überschütten, zuschütten, überhäufen, verschütten, bedecken; verpetzen, verpfeifen; einschlafen	perfective	засыпа'ть	засы'пь	засы'пьте	засы'пал	засы'пала	засы'пало	засы'пали	засы'плю	засы'плешь,засы'пешь	засы'плет,засы'пет	засы'плем,засы'пем	засы'плете,засы'пете	засы'плют,засы'пют
нажать	нажа'ть	press, push	drücken, pressen, andrücken, anpressen; Druck ausüben; klicken, eine Taste betätigen; einen Hebel treten, ein Pedal treten; einen Zahn zulegen	perfective	нажимать	нажми'	нажми'те	нажа'л	нажа'ла	нажа'ло	нажа'ли	нажму'	нажмёшь	нажмёт	нажмём	нажмёте	нажму'т
сложить	сложи'ть	fold; stack; add	legen, zusammenlegen, zusammenlegen zusammenklappen; addieren, zusammenzählen; stapeln; verfassen, dichten, komponieren	perfective	складывать;слагать	сложи'	сложи'те	сложи'л	сложи'ла	сложи'ло	сложи'ли	сложу'	сло'жишь	сло'жит	сло'жим	сло'жите	сло'жат
проявить	прояви'ть	show, display, manifest, reveal	zeigen, bekunden, an den Tag legen; entwickeln	perfective	проявлять	прояви'	прояви'те	прояви'л	прояви'ла	прояви'ло	прояви'ли	проявлю'	проя'вишь	проя'вит	проя'вим	проя'вите	проя'вят
соответствовать	соотве'тствовать	match, correspond, conform, be consistent with	entsprechen, zusammenfallen; übereinstimmen	imperfective	-	соотве'тствуй	соотве'тствуйте	соотве'тствовал	соотве'тствовала	соотве'тствовало	соотве'тствовали	соотве'тствую	соотве'тствуешь	соотве'тствует	соотве'тствуем	соотве'тствуете	соотве'тствуют
обсуждать	обсужда'ть	discuss, talk over	besprechen, durchsprechen; diskutieren, erörtern, konferieren	imperfective	обсудить	обсужда'й	обсужда'йте	обсужда'л	обсужда'ла	обсужда'ло	обсужда'ли	обсужда'ю	обсужда'ешь	обсужда'ет	обсужда'ем	обсужда'ете	обсужда'ют
доказывать	дока'зывать	prove, demonstrate	beweisen, nachweisen	imperfective	доказать	дока'зывай	дока'зывайте	дока'зывал	дока'зывала	дока'зывало	дока'зывали	дока'зываю	дока'зываешь	дока'зывает	дока'зываем	дока'зываете	дока'зывают
заменить	замени'ть	replace	auswechseln / ersetzen, vertreten, ablösen	perfective	заменять	замени'	замени'те	замени'л	замени'ла	замени'ло	замени'ли	заменю'	заме'нишь	заме'нит	замени'м	заме'ните	заме'нят
сломать	слома'ть	break, fracture, quarry	brechen, abbrechen, zerbrechen, zerschlagen, abreißen, niederreißen; kaputt machen	perfective	ломать	слома'й	слома'йте	слома'л	слома'ла	слома'ло	слома'ли	слома'ю	слома'ешь	слома'ет	слома'ем	слома'ете	слома'ют
миновать	минова'ть	pass, be over	vergehen, vorbei sein	imperfective	мину'ть	мину'й	мину'йте	минова'л	минова'ла	минова'ло	минова'ли	мину'ю	мину'ешь	мину'ет	мину'ем	мину'ете	мину'ют
слыхать	слыха'ть	hear	hören, vernehmen, erfahren	imperfective	услыхать			слыха'л	слыха'ла	слыха'ло	слыха'ли
выехать	вы'ехать	leave, move, break, train	losfahren, wegfahren, ausreisen, verreisen, verlassen	perfective	выезжать	выезжа'й	выезжа'йте	вы'ехал	вы'ехала	вы'ехало	вы'ехали	вы'еду	вы'едешь	вы'едет	вы'едем	вы'едете	вы'едут
кивать	кива'ть	to nod, to beckon; to motion, to point, to allude	nicken	imperfective	кивнуть	кива'й	кива'йте	кива'л	кива'ла	кива'ло	кива'ли	кива'ю	кива'ешь	кива'ет	кива'ем	кива'ете	кива'ют
вытянуть	вы'тянуть	draw out, extract, stretch, pull out, hold out	ausdehnen, ausstrecken; aufziehen; erpressen	perfective	вытягивать;тянуть	вы'тяни	вы'тяните	вы'тянул	вы'тянула	вы'тянуло	вы'тянули	вы'тяну	вы'тянешь	вы'тянет	вы'тянем	вы'тянете	вы'тянут
поцеловать	поцелова'ть	kiss, give a kiss	küssen	perfective	целовать	поцелу'й	поцелу'йте	поцелова'л	поцелова'ла	поцелова'ло	поцелова'ли	поцелу'ю	поцелу'ешь	поцелу'ет	поцелу'ем	поцелу'ете	поцелу'ют
использоваться	испо'льзоваться	be used	verwendet werden, gebraucht werden	imperfective	-
грозить	грози'ть	threaten	drohen	imperfective	погрозить,пригрозить	грози'	грози'те	грози'л	грози'ла	грози'ло	грози'ли	грожу'	грози'шь	грози'т	грози'м	грози'те	грозя'т
хранить	храни'ть	keep, save, guard	aufbewahren, wahren; lagern, speichern	imperfective	сохранить	храни'	храни'те	храни'л	храни'ла	храни'ло	храни'ли	храню'	храни'шь	храни'т	храни'м	храни'те	храня'т
шевелиться	шевели'ться	stir, move	sich bewegen, sich rühren	imperfective	пошевелиться,шевельнуться	шевели'сь	шевели'тесь	шевели'лся	шевели'лась	шевели'лось	шевели'лись	шевелю'сь	шевели'шься	шевели'тся	шевели'мся	шевели'тесь	шевеля'тся
доставать	достава'ть	get, obtain; take; reach; annoy, bother, pester	erreichen, reichen, erlangen; herausnehmen, herunternehmen; beschaffen, holen, besorgen, auftreiben; jmd. auf die Nerven gehen	imperfective	достать	достава'й	достава'йте	достава'л	достава'ла	достава'ло	достава'ли	достаю'	достаёшь	достаёт	достаём	достаёте	достаю'т
бросаться	броса'ться	throw oneself, rush, throw at each other, disdain	stürzen, sich werfen, sich stürzen; einander bewerfen; eilen (auch überstürzt handeln); irgendwo hin springen	imperfective	броситься	броса'йся	броса'йтесь	броса'лся	броса'лась	броса'лось	броса'лись	броса'юсь	броса'ешься	броса'ется	броса'емся	броса'етесь	броса'ются
определять	определя'ть	define, determine	bestimmen; definieren, abschätzen, festlegen	imperfective	определить	определя'й	определя'йте	определя'л	определя'ла	определя'ло	определя'ли	определя'ю	определя'ешь	определя'ет	определя'ем	определя'ете	определя'ют
заключить	заключи'ть	sign up	schließen, beenden, ins Gefängnis setzen	perfective	заключать	заключи'	заключи'те	заключи'л	заключи'ла	заключи'ло	заключи'ли	заключу'	заключи'шь	заключи'т	заключи'м	заключи'те	заключа'т
убежать	убежа'ть	run away; boil over	weglaufen, davonlaufen	perfective	убегать	убеги'	убеги'те	убежа'л	убежа'ла	убежа'ло	убежа'ли	убегу'	убежи'шь	убежи'т	убежи'м	убежи'те	убегу'т
доходить	доходи'ть	reach, touch, move, be done, ripen, amount	(hin)gehen / (hin)gelangen; angelangen / ankommen, erreichen, kommen zu	imperfective	дойти	доходи'	доходи'те	доходи'л	доходи'ла	доходи'ло	доходи'ли	дохожу'	дохо'дишь	дохо'дит	дохо'дим	дохо'дите	дохо'дят
посоветовать	посове'товать	advise, counsel	anraten	perfective	советовать	посове'туй	посове'туйте	посове'товал	посове'товала	посове'товало	посове'товали	посове'тую	посове'туешь	посове'тует	посове'туем	посове'туете	посове'туют
успевать	успева'ть	have time, be in time, be successful, get on well, make progress, advance	schaffen, zurechtkommen; rechtzeitig kommen; (verneint:) nicht erreichen, verpassen (planmäßiges Verkehrsmittel); Leistungen (in der Ausbildung) haben	imperfective	успеть	успева'й	успева'йте	успева'л	успева'ла	успева'ло	успева'ли	успева'ю	успева'ешь	успева'ет	успева'ем	успева'ете	успева'ют
светиться	свети'ться	shine	leuchten, funkeln, glänzen, schimmern	imperfective		свети'сь	свети'тесь	свети'лся	свети'лась	свети'лось	свети'лись	свечу'сь	све'тишься	све'тится	све'тимся	све'титесь	све'тятся
