bare	accented	translations_en	translations_de	aspect	partner	imperative_sg	imperative_pl	past_m	past_f	past_n	past_pl	presfut_sg1	presfut_sg2	presfut_sg3	presfut_pl1	presfut_pl2	presfut_pl3
быть	быть	be	sein, werden	imperfective		бу'дь	бу'дьте	бы'л	была'	бы'ло	бы'ли	есть	есть	есть	есть	есть	есть
сказать	сказа'ть	say, tell, speak, talk	sagen, mitteilen	perfective	говорить	скажи'	скажи'те	сказа'л	сказа'ла	сказа'ло	сказа'ли	скажу'	ска'жешь	ска'жет	ска'жем	ска'жете	ска'жут
мочь	мочь	be able, can	können, imstande sein, dürfen	imperfective	смочь	моги'	моги'те	мо'г	могла'	могло'	могли'	могу'	мо'жешь	мо'жет	мо'жем	мо'жете	мо'гут
знать	знать	know, be aware, be acquainted, have a knowledge, aristocracy, nobility, the elite, evidently, it seems	wissen, kennen, sich auskennen, Bescheid wissen, können, verstehen, beherrschen	imperfective	узнать	зна'й	зна'йте	зна'л	зна'ла	зна'ло	зна'ли	зна'ю	зна'ешь	зна'ет	зна'ем	зна'ете	зна'ют
говорить	говори'ть	speak, talk gapirish	sprechen, reden, sagen	imperfective	сказать;поговорить	говори'	говори'те	говори'л	говори'ла	говори'ло	говори'ли	говорю'	говори'шь	говори'т	говори'м	говори'те	говоря'т
есть	есть	eat	essen, fressen	imperfective	съесть;поесть	е'шь	е'шьте	е'л	е'ла	е'ло	е'ли	е'м	е'шь	е'ст	еди'м	еди'те	едя'т
хотеть	хоте'ть	want; to feel like	wollen, möchten, Lust haben	imperfective	захотеть	хоти'	хоти'те	хоте'л	хоте'ла	хоте'ло	хоте'ли	хочу'	хо'чешь	хо'чет	хоти'м	хоти'те	хотя'т
видеть	ви'деть	see	sehen; treffen, begegnen	imperfective	завидеть;увидеть	ви'дь	ви'дьте	ви'дел	ви'дела	ви'дело	ви'дели	ви'жу	ви'дишь	ви'дит	ви'дим	ви'дите	ви'дят
идти	идти'	go, walk	gehen, kommen, folgen, fahren, abgehen, fuhren, vergehen, stattfinden, laufen, gezeigt werden, stehen, passen	imperfective	-	иди'	иди'те	шёл	шла'	шло'	шли'	иду'	идёшь	идёт	идём	идёте	иду'т
стоять	стоя'ть	stand	stehen, halten, anhalten, andauern, sein, herrschen; einstehen, eintreten für, sich einsetzen für	imperfective	постоять	сто'й	сто'йте	стоя'л	стоя'ла	стоя'ло	стоя'ли	стою'	стои'шь	стои'т	стои'м	стои'те	стоя'т
думать	ду'мать	think, consider, reflect, ponder, believe, intend	denken, überlegen, nachdenken, meinen, glauben, beabsichtigen; erinnern; nachdenken	imperfective	подумать	ду'май	ду'майте	ду'мал	ду'мала	ду'мало	ду'мали	ду'маю	ду'маешь	ду'мает	ду'маем	ду'маете	ду'мают
спросить	спроси'ть	ask, inquire, demand	fragen, eine Frage stellen, sich erkundigen, bitten, abfragen	perfective	спрашивать	спроси'	спроси'те	спроси'л	спроси'ла	спроси'ло	спроси'ли	спрошу'	спро'сишь	спро'сит	спро'сим	спро'сите	спро'сят
жить	жить	live	leben, wohnen	imperfective	прожить	живи'	живи'те	жи'л	жила'	жи'ло,жило'	жи'ли	живу'	живёшь	живёт	живём	живёте	живу'т
смотреть	смотре'ть	look, watch	schauen, sehen, ansehen, zusehen	imperfective	посмотреть	смотри'	смотри'те	смотре'л	смотре'ла	смотре'ло	смотре'ли	смотрю'	смо'тришь	смо'трит	смо'трим	смо'трите	смо'трят
иметь	име'ть	have	haben, besitzen; bumsen, ficken, vögeln	imperfective		име'й	име'йте	име'л	име'ла	име'ло	име'ли	име'ю	име'ешь	име'ет	име'ем	име'ете	име'ют
понять	поня'ть	understand, comprehend, realize	verstehen, erkennen; begreifen, einsehen	perfective	понимать	пойми'	пойми'те	по'нял	поняла'	по'няло	по'няли	пойму'	поймёшь	поймёт	поймём	поймёте	пойму'т
сидеть	сиде'ть	sit, be perched, be, fit	sitzen, passen	imperfective	посидеть;сесть	сиди'	сиди'те	сиде'л	сиде'ла	сиде'ло	сиде'ли	сижу'	сиди'шь	сиди'т	сиди'м	сиди'те	сидя'т
делать	де'лать	make, do	machen, erledigen; tun; anfertigen, herstellen	imperfective	сделать;поделать	де'лай	де'лайте	де'лал	де'лала	де'лало	де'лали	де'лаю	де'лаешь	де'лает	де'лаем	де'лаете	де'лают
сделать	сде'лать	make; do	machen, erledigen; tun; anfertigen, herstellen	perfective	делать	сде'лай	сде'лайте	сде'лал	сде'лала	сде'лало	сде'лали	сде'лаю	сде'лаешь	сде'лает	сде'лаем	сде'лаете	сде'лают
взять	взять	take, hire	nehmen, holen	perfective	брать;взимать;взымать	возьми'	возьми'те	взя'л	взяла'	взя'ло,взяло'	взя'ли	возьму'	возьмёшь	возьмёт	возьмём	возьмёте	возьму'т
понимать	понима'ть	understand, comprehend, realize	verstehen, erkennen; begreifen, einsehen	imperfective	понять	понима'й	понима'йте	понима'л	понима'ла	понима'ло	понима'ли	понима'ю	понима'ешь	понима'ет	понима'ем	понима'ете	понима'ют
казаться	каза'ться	seem, appear, strike as, look	scheinen (den Anschein haben, anmuten), erscheinen, aussehen, zu sein scheinen, vorkommen	imperfective	показаться	кажи'сь	кажи'тесь	каза'лся	каза'лась	каза'лось	каза'лись	кажу'сь	ка'жешься	ка'жется	ка'жемся	ка'жетесь	ка'жутся
начать	нача'ть	begin, start, commence	anfangen, beginnen	perfective	начинать	начни'	начни'те	на'чал	начала'	на'чало	на'чали	начну'	начнёшь	начнёт	начнём	начнёте	начну'т
увидеть	уви'деть	see	sehen, erblicken, bemerken; treffen, begegnen	perfective	видеть	уви'дь	уви'дьте	уви'дел	уви'дела	уви'дело	уви'дели	уви'жу	уви'дишь	уви'дит	уви'дим	уви'дите	уви'дят
давать	дава'ть	give	geben; gewähren	imperfective	дать	дава'й	дава'йте	дава'л	дава'ла	дава'ло	дава'ли	даю'	даёшь	даёт	даём	даёте	даю'т
пойти	пойти'	go; walk	losgehen (gehen, aufbrechen), loslaufen, sich auf den Weg machen, in Gang kommen, └ seinen / ihren┘ Lauf nehmen; anfangen / beginnen (losgehen), starten; geraten nach / kommen nach	perfective	-	пойди'	пойди'те	пошёл	пошла'	пошло'	пошли'	пойду'	пойдёшь	пойдёт	пойдём	пойдёте	пойду'т
остаться	оста'ться	remain, stay, be left	bleiben; übrig bleiben; zufallen, in den Besitz übergehen, erben	perfective	оставаться	оста'нься	оста'ньтесь	оста'лся	оста'лась	оста'лось	оста'лись	оста'нусь	оста'нешься	оста'нется	оста'немся	оста'нетесь	оста'нутся
выйти	вы'йти	leave, go out, get out; be published, be issued; to marry (him)	hinausgehen, hinaustreten, verlassen, aussteigen, herauskommen; alle sein, ausgehen; gelingen, geraten; erscheinen, herauskommen	perfective	выходить	вы'йди	вы'йдите	вы'шел	вы'шла	вы'шло	вы'шли	вы'йду	вы'йдешь	вы'йдет	вы'йдем	вы'йдете	вы'йдут
дать	дать	give	geben	perfective	давать	да'й	да'йте	да'л	дала'	да'ло,дало'	да'ли	да'м	да'шь	да'ст	дади'м	дади'те	даду'т
работать	рабо'тать	work, operate	arbeiten, berufstätig sein, sein, tätig sein, geöffnet sein; funktionieren, in Betrieb sein, gehen, laufen	imperfective	поработать;сработать	рабо'тай	рабо'тайте	рабо'тал	рабо'тала	рабо'тало	рабо'тали	рабо'таю	рабо'таешь	рабо'тает	рабо'таем	рабо'таете	рабо'тают
оказаться	оказа'ться	to turn out to be, to be found to be	sich erweisen / herausstellen, sich entpuppen; sich befinden, geraten, gelangen	perfective	оказываться	окажи'сь	окажи'тесь	оказа'лся	оказа'лась	оказа'лось	оказа'лись	окажу'сь	ока'жешься	ока'жется	ока'жемся	ока'жетесь	ока'жутся
ответить	отве'тить	answer, reply, respond	antworten, beantworten; verantworten	perfective	отвечать	отве'ть	отве'тьте	отве'тил	отве'тила	отве'тило	отве'тили	отве'чу	отве'тишь	отве'тит	отве'тим	отве'тите	отве'тят
подумать	поду'мать	think a little, for a while	denken, überlegen	perfective	думать	поду'май	поду'майте	поду'мал	поду'мала	поду'мало	поду'мали	поду'маю	поду'маешь	поду'мает	поду'маем	поду'маете	поду'мают
любить	люби'ть	love; like	lieben, mögen, liebhaben, gern haben	imperfective	полюбить	люби'	люби'те	люби'л	люби'ла	люби'ло	люби'ли	люблю'	лю'бишь	лю'бит	лю'бим	лю'бите	лю'бят
значить	зна'чить	mean, signify	bedeuten, heißen, gelten	imperfective		зна'чь	зна'чьте	зна'чил	зна'чила	зна'чило	зна'чили	зна'чу	зна'чишь	зна'чит	зна'чим	зна'чите	зна'чат
ждать	ждать	wait, expect, await	warten, erwarten	imperfective	подождать	жди'	жди'те	жда'л	ждала'	жда'ло	жда'ли	жду'	ждёшь	ждёт	ждём	ждёте	жду'т
посмотреть	посмотре'ть	look, watch	schauen, sehen, ansehen	perfective	смотреть	посмотри'	посмотри'те	посмотре'л	посмотре'ла	посмотре'ло	посмотре'ли	посмотрю'	посмо'тришь	посмо'трит	посмо'трим	посмо'трите	посмо'трят
найти	найти'	find	finden, ausfindig machen	perfective	находить	найди'	найди'те	нашёл	нашла'	нашло'	нашли'	найду'	найдёшь	найдёт	найдём	найдёте	найду'т
лежать	лежа'ть	lay; be situated	liegen; Platz!	imperfective	лечь;полежать	лежи'	лежи'те	лежа'л	лежа'ла	лежа'ло	лежа'ли	лежу'	лежи'шь	лежи'т	лежи'м	лежи'те	лежа'т
решить	реши'ть	decide, determine, resolve, be determined, solve	lösen; entscheiden, beschließen, einen Entschluß fassen, eine Entscheidung treffen	perfective	решать	реши'	реши'те	реши'л	реши'ла	реши'ло	реши'ли	решу'	реши'шь	реши'т	реши'м	реши'те	реша'т
получить	получи'ть	receive, get, obtain	bekommen, empfangen; erhalten	perfective	получать	получи'	получи'те	получи'л	получи'ла	получи'ло	получи'ли	получу'	полу'чишь	полу'чит	полу'чим	полу'чите	полу'чат
писать	писа'ть	write; paint	schreiben, malen	imperfective	написать	пиши'	пиши'те	писа'л	писа'ла	писа'ло	писа'ли	пишу'	пи'шешь	пи'шет	пи'шем	пи'шете	пи'шут
вернуться	верну'ться	return	zurückkehren; zurückkommen, zurück sein	perfective	возвращаться	верни'сь	верни'тесь	верну'лся	верну'лась	верну'лось	верну'лись	верну'сь	вернёшься	вернётся	вернёмся	вернётесь	верну'тся
считать	счита'ть	consider, deem, find, think; count, compute	glauben (jmd./etw. zählen zu), halten für, meinen, denken; zählen, rechnen	imperfective	честь;счесть;посчитать	счита'й	счита'йте	счита'л	счита'ла	счита'ло	счита'ли	счита'ю	счита'ешь	счита'ет	счита'ем	счита'ете	счита'ют
помнить	по'мнить	remember, keep in mind	sich erinnern, denken an	imperfective	запомнить	по'мни	по'мните	по'мнил	по'мнила	по'мнило	по'мнили	по'мню	по'мнишь	по'мнит	по'мним	по'мните	по'мнят
узнать	узна'ть	know, recognize, discover; learn, find out; get to know	erkennen, wiedererkennen; erfahren, in Erfahrung bringen, sich erkundigen nach; etw. / jmd. kennenlernen	perfective	знать;узнавать	узна'й	узна'йте	узна'л	узна'ла	узна'ло	узна'ли	узна'ю	узна'ешь	узна'ет	узна'ем	узна'ете	узна'ют
прийти	прийти'	come, arrive	ankommen, (her)kommen, angelangen	perfective	приходить	приди'	приди'те	пришёл	пришла'	пришло'	пришли'	приду'	придёшь	придёт	придём	придёте	приду'т
ходить	ходи'ть	go, walk, move, pass	gehen, fahren, verkehren; etw. umgehen, zur Seite gehen	imperfective	сходить	ходи'	ходи'те	ходи'л	ходи'ла	ходи'ло	ходи'ли	хожу'	хо'дишь	хо'дит	хо'дим	хо'дите	хо'дят
заметить	заме'тить	notice, note, observe, sight, catch sight, pay heed, remark	bemerken, merken, sagen, eine Bemerkung machen	perfective	замечать	заме'ть	заме'тьте	заме'тил	заме'тила	заме'тило	заме'тили	заме'чу	заме'тишь	заме'тит	заме'тим	заме'тите	заме'тят
бывать	быва'ть	to be at, to have; to visit; to happen/occur	vorkommen, geschehen, passieren, stattfinden, sein	imperfective	побывать	быва'й	быва'йте	быва'л	быва'ла	быва'ло	быва'ли	быва'ю	быва'ешь	быва'ет	быва'ем	быва'ете	быва'ют
слышать	слы'шать	hear	hören	imperfective	услышать	слы'шь	слы'шьте	слы'шал	слы'шала	слы'шало	слы'шали	слы'шу	слы'шишь	слы'шит	слы'шим	слы'шите	слы'шат
уйти	уйти'	leave, depart	weggehen, fortgehen, verlassen, gehen in (Rente, Urlaub etc.), abfahren. wegfahren; entgehen, entrinnen, entkommen	perfective	уходить	уйди'	уйди'те	ушёл	ушла'	ушло'	ушли'	уйду'	уйдёшь	уйдёт	уйдём	уйдёте	уйду'т
бояться	боя'ться	be afraid, dread, fear	Angst haben, sich fürchten; etw. fürchten / befürchten	imperfective	побояться;забояться	бо'йся	бо'йтесь	боя'лся	боя'лась	боя'лось	боя'лись	бою'сь	бои'шься	бои'тся	бои'мся	бои'тесь	боя'тся
слушать	слу'шать	listen, hear, attend, examine chest, auscultate, obey	zuhören, * hören (nur im Sinne von "auch zuhören"); hinhören, lauschen	imperfective	послушать	слу'шай	слу'шайте	слу'шал	слу'шала	слу'шало	слу'шали	слу'шаю	слу'шаешь	слу'шает	слу'шаем	слу'шаете	слу'шают
глядеть	гляде'ть	look, peer, show, face, look out, give, point, look like, see	anblicken, anschauen; einen Blick werfen auf (aufpassen)	imperfective	глянуть;поглядеть	гляди'	гляди'те	гляде'л	гляде'ла	гляде'ло	гляде'ли	гляжу'	гляди'шь	гляди'т	гляди'м	гляди'те	глядя'т
сесть	сесть	sit down	sich setzen, sich hinsetzen, Platz nehmen	perfective	садиться	сядь	ся'дьте	се'л	се'ла	се'ло	се'ли	ся'ду	ся'дешь	ся'дет	ся'дем	ся'дете	ся'дут
оставаться	остава'ться	remain, stay, be left	bleiben, sein, übrigbleiben	imperfective	остаться	остава'йся	остава'йтесь	остава'лся	остава'лась	остава'лось	остава'лись	остаю'сь	остаёшься	остаётся	остаёмся	остаётесь	остаю'тся
хотеться	хоте'ться	like	wollen, mögen, möchten, Lust haben	imperfective	захотеться					хоте'лось				хо'чется
написать	написа'ть	write; paint	schreiben; malen	perfective	писать	напиши'	напиши'те	написа'л	написа'ла	написа'ло	написа'ли	напишу'	напи'шешь	напи'шет	напи'шем	напи'шете	напи'шут
пусть	пусть	Let be	lass / möge / soll ...; wenn auch, obwohl, selbst wenn; sei	perfective
читать	чита'ть	read	lesen	imperfective	прочитать;почитать;прочесть	чита'й	чита'йте	чита'л	чита'ла	чита'ло	чита'ли	чита'ю	чита'ешь	чита'ет	чита'ем	чита'ете	чита'ют
чувствовать	чу'вствовать	feel, have a sensation, sense	fühlen, empfinden, spüren	imperfective	почувствовать	чу'вствуй	чу'вствуйте	чу'вствовал	чу'вствовала	чу'вствовало	чу'вствовали	чу'вствую	чу'вствуешь	чу'вствует	чу'вствуем	чу'вствуете	чу'вствуют
вести	вести'	lead, conduct, direct; drive a car; to behave (oneself); to keep a diary	führen, (ge)leiten; fahren, lenken (ein Fahrzeug "führen" etc.); sich verhalten, sich benehmen, sich (auf)führen	imperfective	повести	веди'	веди'те	вёл	вела'	вело'	вели'	веду'	ведёшь	ведёт	ведём	ведёте	веду'т
продолжать	продолжа'ть	continue, go on, proceed, keep on, extend, prolong	fortsetzen, weitermachen	imperfective	продолжить	продолжа'й	продолжа'йте	продолжа'л	продолжа'ла	продолжа'ло	продолжа'ли	продолжа'ю	продолжа'ешь	продолжа'ет	продолжа'ем	продолжа'ете	продолжа'ют
успеть	успе'ть	to have time, to find time; to manage, to succeed; to arrive in time (for); to catch	es schaffen, rechtzeitig kommen, mitkommen; etw. erreichen, etw. erwischen	perfective	успевать	успе'й	успе'йте	успе'л	успе'ла	успе'ло	успе'ли	успе'ю	успе'ешь	успе'ет	успе'ем	успе'ете	успе'ют
брать	брать	take	nehmen, holen; einstellen	imperfective	взять;побрать	бери'	бери'те	бра'л	брала'	бра'ло	бра'ли	беру'	берёшь	берёт	берём	берёте	беру'т
пройти	пройти'	pass; get to, go to, reach; make one's way	vorübergehen / vorbeigehen, zurückliegen, vergehen, vorbei sein, aufhören; stattfinden, verlaufen, durchnehmen, behandeln	perfective	проходить	пройди'	пройди'те	прошёл	прошла'	прошло'	прошли'	пройду'	пройдёшь	пройдёт	пройдём	пройдёте	пройду'т
начинать	начина'ть	begin, start, commence	anfangen, beginnen	imperfective	начать	начина'й	начина'йте	начина'л	начина'ла	начина'ло	начина'ли	начина'ю	начина'ешь	начина'ет	начина'ем	начина'ете	начина'ют
появиться	появи'ться	appear, show up, emerge	erscheinen, auftauchen, auftreten, aufkommen, entstehen; sich zeigen, sichtbar werden	perfective	появляться	появи'сь	появи'тесь	появи'лся	появи'лась	появи'лось	появи'лись	появлю'сь	поя'вишься	поя'вится	поя'вимся	поя'витесь	поя'вятся
забыть	забы'ть	forget	vergessen; verabsäumen, nicht denken an	perfective	забывать	забу'дь	забу'дьте	забы'л	забы'ла	забы'ло	забы'ли	забу'ду	забу'дешь	забу'дет	забу'дем	забу'дете	забу'дут
вспомнить	вспо'мнить	remember, recollect, recall, think of	sich erinnern, sich entsinnen, zurückdenken	perfective	вспоминать	вспо'мни	вспо'мните	вспо'мнил	вспо'мнила	вспо'мнило	вспо'мнили	вспо'мню	вспо'мнишь	вспо'мнит	вспо'мним	вспо'мните	вспо'мнят
пытаться	пыта'ться	try to	versuchen, probieren, sich bemühen	imperfective	попытаться	пыта'йся	пыта'йтесь	пыта'лся	пыта'лась	пыта'лось	пыта'лись	пыта'юсь	пыта'ешься	пыта'ется	пыта'емся	пыта'етесь	пыта'ются
находиться	находи'ться	be situated	sich befinden, vorhanden sein, sich aufhalten	imperfective	найтись	находи'сь	находи'тесь	находи'лся	находи'лась	находи'лось	находи'лись	нахожу'сь	нахо'дишься	нахо'дится	нахо'димся	нахо'дитесь	нахо'дятся
держать	держа'ть	keep; hold	halten, festhalten; behalten, aufbewahren; verhalten, benehmen	imperfective	подержать;сдержать	держи'	держи'те	держа'л	держа'ла	держа'ло	держа'ли	держу'	де'ржишь	де'ржит	де'ржим	де'ржите	де'ржат
просить	проси'ть	request, ask for	bitten, auffordern, einladen	imperfective	попросить	проси'	проси'те	проси'л	проси'ла	проси'ло	проси'ли	прошу'	про'сишь	про'сит	про'сим	про'сите	про'сят
показать	показа'ть	show, display, point	zeigen, herzeigen, vorführen; aufzeigen, aufweisen; vorzeigen, vorweisen (Leistung, Fähigkeiten: sich auszeichnen)	perfective	показывать	покажи'	покажи'те	показа'л	показа'ла	показа'ло	показа'ли	покажу'	пока'жешь	пока'жет	пока'жем	пока'жете	пока'жут
выходить	выходи'ть	go out, come out, leave; use up, run out of; get married; be published, be issued	herausgehen, verlassen, aussteigen	imperfective	вы'йти	выходи'	выходи'те	выходи'л	выходи'ла	выходи'ло	выходи'ли	выхожу'	выхо'дишь	выхо'дит	выхо'дим	выхо'дите	выхо'дят
поднять	подня'ть	lift, raise, lift up, heave, pick up	aufheben, aufsammeln, hochhelfen, heben, hochheben, hochnehmen, wecken; steigern, erhöhen	perfective	поднимать	подними'	подними'те	по'днял,подня'л	подняла'	по'дняло,подня'ло	по'дняли,подня'ли	подниму'	подни'мешь	подни'мет	подни'мем	подни'мете	подни'мут
называть	называ'ть	name, call	nennen / benennen	imperfective	назвать	называ'й	называ'йте	называ'л	называ'ла	называ'ло	называ'ли	называ'ю	называ'ешь	называ'ет	называ'ем	называ'ете	называ'ют
послать	посла'ть	send, dispatch	schicken, senden	perfective	посылать;слать	пошли'	пошли'те	посла'л	посла'ла	посла'ло	посла'ли	пошлю'	пошлёшь	пошлёт	пошлём	пошлёте	пошлю'т
подойти	подойти'	approach	herantreten, kommen, sich nähern, heranrücken; passen, geeignet sein	perfective	подходить	подойди'	подойди'те	подошёл	подошла'	подошло'	подошли'	подойду'	подойдёшь	подойдёт	подойдём	подойдёте	подойду'т
рассказать	рассказа'ть	say, tell	erzählen, berichten, mitteilen	perfective	рассказывать	расскажи'	расскажи'те	рассказа'л	рассказа'ла	рассказа'ло	рассказа'ли	расскажу'	расска'жешь	расска'жет	расска'жем	расска'жете	расска'жут
