bare	accented	translations_en	translations_de	aspect	partner	imperative_sg	imperative_pl	past_m	past_f	past_n	past_pl	presfut_sg1	presfut_sg2	presfut_sg3	presfut_pl1	presfut_pl2	presfut_pl3
дёргать	дёргать	pull, tug, pull out, move sharply, jerk, worry, pull about, pester	zupfen, ziehen, zerren	imperfective	дёрнуть	дёргай	дёргайте	дёргал	дёргала	дёргало	дёргали	дёргаю	дёргаешь	дёргает	дёргаем	дёргаете	дёргают
уничтожать	уничтожа'ть	destroy, do away, annihilate, obliterate, crush, abolish	vernichten, ausrotten, zerstören, beseitigen, abschaffen	imperfective	уничтожить	уничтожа'й	уничтожа'йте	уничтожа'л	уничтожа'ла	уничтожа'ло	уничтожа'ли	уничтожа'ю	уничтожа'ешь	уничтожа'ет	уничтожа'ем	уничтожа'ете	уничтожа'ют
разыскать	разыска'ть	look, search, find	finden, ausfindig machen	perfective	разыскивать	разыщи'	разыщи'те	разыска'л	разыска'ла	разыска'ло	разыска'ли	разыщу'	разы'щешь	разы'щет	разы'щем	разы'щете	разы'щут
расставаться	расстава'ться	part, leave, break up with	auseinandergehen, sich verabschieden, sich trennen	imperfective	расстаться	расстава'йся	расстава'йтесь	расстава'лся	расстава'лась	расстава'лось	расстава'лись	расстаю'сь	расстаёшься	расстаётся	расстаёмся	расстаётесь	расстаю'тся
загнать	загна'ть	to corner, trap	hineinjagen, hineintreiben, in die Enge treiben; abhetzen, scheuchen	perfective	загонять	загони'	загони'те	загна'л	загнала'	загна'ло	загна'ли	загоню'	заго'нишь	заго'нит	заго'ним	заго'ните	заго'нят
пересечь	пересе'чь	cross, traverse, intersect, cut	durchqueren, überqueren, durchkreuzen, schneiden, kreuzen	perfective	пересекать	пересеки'	пересеки'те	пересёк	пересекла'	пересекло'	пересекли'	пересеку'	пересечёшь	пересечёт	пересечём	пересечёте	пересеку'т
смутиться	смути'ться	be confused, be embarrassed, be put out of countenance	verlegen werden, in Verlegenheit geraten	perfective	смущаться	смути'сь	смути'тесь	смути'лся	смути'лась	смути'лось	смути'лись	смучу'сь	смути'шься	смути'тся	смути'мся	смути'тесь	смутя'тся
раздавить	раздави'ть	crush, squash, overwhelm	zerdrücken, zerquetschen; überfahren, töten; vernichten, zerschmettern; niederdrücken, bedrücken	perfective	раздавливать	раздави'	раздави'те	раздави'л	раздави'ла	раздави'ло	раздави'ли	раздавлю'	разда'вишь	разда'вит	разда'вим	разда'вите	разда'вят
утвердить	утверди'ть	affirm, maintain, assert, contend, allege, asseverate, approve, confirm, sanction, ratify, prove, strengthen, consolidate	bestätigen (bewilligen, billigen), sanktionieren, verabschieden	perfective	утверждать	утверди'	утверди'те	утверди'л	утверди'ла	утверди'ло	утверди'ли	утвержу'	утверди'шь	утверди'т	утверди'м	утверди'те	утвердя'т
заканчиваться	зака'нчиваться	come to an end close, end	zu Ende gehen, enden	imperfective	закончиться	зака'нчивайся	зака'нчивайтесь	зака'нчивался	зака'нчивалась	зака'нчивалось	зака'нчивались	зака'нчиваюсь	зака'нчиваешься	зака'нчивается	зака'нчиваемся	зака'нчиваетесь	зака'нчиваются
украсить	укра'сить	decorate, adorn, beautify, ornament	schmücken, ausschmücken, dekorieren; verzieren	perfective	украшать	укра'сь	укра'сьте	укра'сил	укра'сила	укра'сило	укра'сили	укра'шу	укра'сишь	укра'сит	укра'сим	укра'сите	укра'сят
добывать	добыва'ть	manage to get, obtain, procure, extract, mine	fördern / gewinnen (Bodenschätze etc.); sich verschaffen / auftreiben, beschaffen	imperfective	добыть	добыва'й	добыва'йте	добыва'л	добыва'ла	добыва'ло	добыва'ли	добыва'ю	добыва'ешь	добыва'ет	добыва'ем	добыва'ете	добыва'ют
осматривать	осма'тривать	examine, survey, view, scan, see, inspect	besichtigen, genau betrachten, in Augenschein nehmen; untersuchen (anschauen)	imperfective	осмотреть	осма'тривай	осма'тривайте	осма'тривал	осма'тривала	осма'тривало	осма'тривали	осма'триваю	осма'триваешь	осма'тривает	осма'триваем	осма'триваете	осма'тривают
контролировать	контроли'ровать	control, check	kontrollieren, überprüfen	imperfective	проконтролировать	контроли'руй	контроли'руйте	контроли'ровал	контроли'ровала	контроли'ровало	контроли'ровали	контроли'рую	контроли'руешь	контроли'рует	контроли'руем	контроли'руете	контроли'руют
вскинуть	вски'нуть	throw up	aufwerfen	perfective	вскидывать	вски'нь	вски'ньте	вски'нул	вски'нула	вски'нуло	вски'нули	вски'ну	вски'нешь	вски'нет	вски'нем	вски'нете	вски'нут
помчаться	помча'ться	dart, begin to tear along	spurten, rasen	perfective	мчаться	помчи'сь	помчи'тесь	помча'лся	помча'лась	помча'лось	помча'лись	помчу'сь	помчи'шься	помчи'тся	помчи'мся	помчи'тесь	помча'тся
шевелить	шевели'ть	stir, move	bewegen, rühren; antreiben, in Bewegung versetzen	imperfective	пошевелить,шевельнуть	шевели'	шевели'те	шевели'л	шевели'ла	шевели'ло	шевели'ли	шевелю'	шевели'шь	шевели'т	шевели'м	шевели'те	шевеля'т
растерять	растеря'ть	to lose, waste, squander	verlieren	perfective		растеря'й	растеря'йте	растеря'л	растеря'ла	растеря'ло	растеря'ли	растеря'ю	растеря'ешь	растеря'ет	растеря'ем	растеря'ете	растеря'ют
опрокинуть	опроки'нуть	overturn, topple over, frustrate, refute, overthrow, overrun, knock back	umwerfen, umstürzen, umkippen	perfective	опрокидывать	опроки'нь	опроки'ньте	опроки'нул	опроки'нула	опроки'нуло	опроки'нули	опроки'ну	опроки'нешь	опроки'нет	опроки'нем	опроки'нете	опроки'нут
погрузить	погрузи'ть	to submerge, to immerse, to plunge; to load	laden, beladen, füllen, aufladen, befrachten; versenken	perfective	грузить	погрузи'	погрузи'те	погрузи'л	погрузи'ла	погрузи'ло	погрузи'ли	погружу'	погру'зишь	погру'зит	погру'зим	погру'зите	погру'зят
возвратиться	возврати'ться	return	zurückkommen; zurückkehren, zurück sein	perfective	возвращаться	возврати'сь	возврати'тесь	возврати'лся	возврати'лась	возврати'лось	возврати'лись	возвращу'сь	возврати'шься	возврати'тся	возврати'мся	возврати'тесь	возвратя'тся
взорваться	взорва'ться	burst, blow up, explode burst, explode, fly into a rage	explodieren, detonieren, in die Luft fliegen	perfective	взрываться	взорви'сь	взорви'тесь	взорва'лся	взорвала'сь	взорва'лось//взорвало'сь	взорва'лись//взорвали'сь	взорву'сь	взорвёшься	взорвётся	взорвёмся	взорвётесь	взорву'тся
обхватить	обхвати'ть	embrace, grapple, clasp, encompass	umfassen	perfective	обхватывать	обхвати'	обхвати'те	обхвати'л	обхвати'ла	обхвати'ло	обхвати'ли	обхвачу'	обхва'тишь	обхва'тит	обхва'тим	обхва'тите	обхва'тят
распространяться	распространя'ться	spread, enlarge, expatiate, dilate; to apply, pertain	sich verbreiten, sich ausdehnen, sich ausbreiten, sich erstrecken	imperfective	распространиться	распространя'йся	распространя'йтесь	распространя'лся	распространя'лась	распространя'лось	распространя'лись	распространя'юсь	распространя'ешься	распространя'ется	распространя'емся	распространя'етесь	распространя'ются
вскрикнуть	вскри'кнуть	cry out, utter a scream, utter a shriek	aufschreien	perfective	вскрикивать	вскри'кни	вскри'кните	вскри'кнул	вскри'кнула	вскри'кнуло	вскри'кнули	вскри'кну	вскри'кнешь	вскри'кнет	вскри'кнем	вскри'кнете	вскри'кнут
возглавлять	возглавля'ть	place oneself at the head, head, be at the head, lead	an der Spitze stehen, leiten	imperfective	возглавить	возглавля'й	возглавля'йте	возглавля'л	возглавля'ла	возглавля'ло	возглавля'ли	возглавля'ю	возглавля'ешь	возглавля'ет	возглавля'ем	возглавля'ете	возглавля'ют
откинуться	отки'нуться	to get out, be released; to lean; to set asside	sich zurücklehnen	perfective	откидываться	отки'нься	отки'ньтесь	отки'нулся	отки'нулась	отки'нулось	отки'нулись	отки'нусь	отки'нешься	отки'нется	отки'немся	отки'нетесь	отки'нутся
дружить	дружи'ть	be friends, be on friendly terms	befreundet sein, Freundschaft halten	imperfective	-	дружи'	дружи'те	дружи'л	дружи'ла	дружи'ло	дружи'ли	дружу'	дру'жишь	дру'жит	дру'жим	дру'жите	дру'жат
отрывать	отрыва'ть	tear off, tear away, rip off	abreißen, losreißen, (ab)trennen	imperfective	оторвать	отрыва'й	отрыва'йте	отрыва'л	отрыва'ла	отрыва'ло	отрыва'ли	отрыва'ю	отрыва'ешь	отрыва'ет	отрыва'ем	отрыва'ете	отрыва'ют
перебивать	перебива'ть	interrupt, spoil, kill	unterbrechen, ins Wort fallen; zerbrechen, zerschlagen	imperfective	перебить	перебива'й	перебива'йте	перебива'л	перебива'ла	перебива'ло	перебива'ли	перебива'ю	перебива'ешь	перебива'ет	перебива'ем	перебива'ете	перебива'ют
увеличиваться	увели'чиваться	increase, rise	sich vergrössern; sich steigern	imperfective	увеличиться	увели'чивайся	увели'чивайтесь	увели'чивался	увели'чивалась	увели'чивалось	увели'чивались	увели'чиваюсь	увели'чиваешься	увели'чивается	увели'чиваемся	увели'чиваетесь	увели'чиваются
кидать	кида'ть	throw, cast, fling	werfen, schmeißen, schleudern; betrügen; jmd. zurücklassen	imperfective	кинуть;покидать	кида'й	кида'йте	кида'л	кида'ла	кида'ло	кида'ли	кида'ю	кида'ешь	кида'ет	кида'ем	кида'ете	кида'ют
воображать	вообража'ть	imagine, fancy	wähnen, sich denken, sich vorstellen, sich einbilden; sich einbilden	imperfective	вообразить	вообража'й	вообража'йте	вообража'л	вообража'ла	вообража'ло	вообража'ли	вообража'ю	вообража'ешь	вообража'ет	вообража'ем	вообража'ете	вообража'ют
мерцать	мерца'ть	twinkle, shimmer, glimmer, flicker	flimmern, schimmern, flackern	imperfective		мерца'й	мерца'йте	мерца'л	мерца'ла	мерца'ло	мерца'ли	мерца'ю	мерца'ешь	мерца'ет	мерца'ем	мерца'ете	мерца'ют
раскалить	раскали'ть	make burning hot, bring to a great heat, incandesce	zur Weißglut erhitzen, glühend machen, ausglühen, glühen	perfective	раскаливать,раскалять	раскали'	раскали'те	раскали'л	раскали'ла	раскали'ло	раскали'ли	раскалю'	раскали'шь	раскали'т	раскали'м	раскали'те	раскаля'т
скользнуть	скользну'ть	slip, slide	rutschen, ins Rutschen kommen; gleiten, schlittern	perfective	скользить	скользни'	скользни'те	скользну'л	скользну'ла	скользну'ло	скользну'ли	скользну'	скользнёшь	скользнёт	скользнём	скользнёте	скользну'т
притихнуть	прити'хнуть	grow quiet down, hush, sing small, pipe down	still werden	perfective	притихать	прити'хни	прити'хните	прити'х	прити'хла	прити'хло	прити'хли	прити'хну	прити'хнешь	прити'хнет	прити'хнем	прити'хнете	прити'хнут
назначать	назнача'ть	fix / nominate set, appoint, nominate, prescribe; prescribe	ernennen, benennen, berufen zu; festlegen, bestimmen, festsetzen; verordnen, verschreiben, anordnen	imperfective	назначить	назнача'й	назнача'йте	назнача'л	назнача'ла	назнача'ло	назнача'ли	назнача'ю	назнача'ешь	назнача'ет	назнача'ем	назнача'ете	назнача'ют
ринуться	ри'нуться	rush, dash, dart	stürzen	perfective		ри'нься	ри'ньтесь	ри'нулся	ри'нулась	ри'нулось	ри'нулись	ри'нусь	ри'нешься	ри'нется	ри'немся	ри'нетесь	ри'нутся
заинтересовать	заинтересова'ть	interest	interessieren, jemandes Interesse wecken, interessiert machen	perfective	интересовать,заинтересовывать	заинтересу'й	заинтересу'йте	заинтересова'л	заинтересова'ла	заинтересова'ло	заинтересова'ли	заинтересу'ю	заинтересу'ешь	заинтересу'ет	заинтересу'ем	заинтересу'ете	заинтересу'ют
напугать	напуга'ть	frighten, scare	erschrecken	perfective	пугать	напуга'й	напуга'йте	напуга'л	напуга'ла	напуга'ло	напуга'ли	напуга'ю	напуга'ешь	напуга'ет	напуга'ем	напуга'ете	напуга'ют
скомандовать	скома'ндовать	give out an order, order, command	einen Befehl erteilen	perfective		скома'ндуй	скома'ндуйте	скома'ндовал	скома'ндовала	скома'ндовало	скома'ндовали	скома'ндую	скома'ндуешь	скома'ндует	скома'ндуем	скома'ндуете	скома'ндуют
донести	донести'	carry, bring, be able to carry as far as	tragen (bis/nach); anzeigen / denunzieren	perfective	доносить	донеси'	донеси'те	донёс	донесла'	донесло'	донесли'	донесу'	донесёшь	донесёт	донесём	донесёте	донесу'т
припомнить	припо'мнить	to remember, to recall; to get even, to revenge	sich erinnern, sich besinnen, sich entsinnen	perfective	припоминать	припо'мни	припо'мните	припо'мнил	припо'мнила	припо'мнило	припо'мнили	припо'мню	припо'мнишь	припо'мнит	припо'мним	припо'мните	припо'мнят
разрешать	разреша'ть	allow, permit, authorize; resolve, settle	erlauben, gestatten, bewilligen, genehmigen, zustimmen; lösen (Problem, Rätsel, Streit etc.)	imperfective	разрешить	разреша'й	разреша'йте	разреша'л	разреша'ла	разреша'ло	разреша'ли	разреша'ю	разреша'ешь	разреша'ет	разреша'ем	разреша'ете	разреша'ют
закусить	закуси'ть	shut up	einen Imbiss nehmen, etwas zu sich nehmen	perfective	закусывать	закуси'	закуси'те	закуси'л	закуси'ла	закуси'ло	закуси'ли	закушу'	заку'сишь	заку'сит	заку'сим	заку'сите	заку'сят
разложить	разложи'ть		legen, ausbreiten, verteilen; zerlegen, zersetzen, demoralisieren	perfective	раскладывать	разложи'	разложи'те	разложи'л	разложи'ла	разложи'ло	разложи'ли	разложу'	разло'жишь	разло'жит	разло'жим	разло'жите	разло'жат
ворчать	ворча'ть	grumble, growl, snarl	brummen, knurren, anknurren	imperfective	проворчать	ворчи'	ворчи'те	ворча'л	ворча'ла	ворча'ло	ворча'ли	ворчу'	ворчи'шь	ворчи'т	ворчи'м	ворчи'те	ворча'т
покатиться	покати'ться	start rolling, roll	rollen, kugeln	perfective	катиться	покати'сь	покати'тесь	покати'лся	покати'лась	покати'лось	покати'лись	покачу'сь	пока'тишься	пока'тится	пока'тимся	пока'титесь	пока'тятся
отражать	отража'ть	reflect; repulse, repel, parry	widerspiegeln, reflektieren, wiedergeben, zum Ausdruck bringen, (künstlerischen) Ausdruck verleihen	imperfective	отразить	отража'тй	отража'тйте	отража'тл	отража'тла	отража'тло	отража'тли	отража'ю	отража'ешь	отража'ет	отража'ем	отража'ете	отража'ют
осуществлять	осуществля'ть	to realize, accomplish, fulfill, put into practice; to carry out, implement; exercise, in terms of rights or control	verwirklichen, in die Tat umsetzen	imperfective	осуществить	осуществля'й	осуществля'йте	осуществля'л	осуществля'ла	осуществля'ло	осуществля'ли	осуществля'ю	осуществля'ешь	осуществля'ет	осуществля'ем	осуществля'ете	осуществля'ют
вынимать	вынима'ть	take out, pull out, extract, draw	herausnehmen, holen, herausziehen, entfernen	imperfective	вынуть	вынима'й	вынима'йте	вынима'л	вынима'ла	вынима'ло	вынима'ли	вынима'ю	вынима'ешь	вынима'ет	вынима'ем	вынима'ете	вынима'ют
норовить	норови'ть	aim, strive	erpicht sein, es darauf anlegen	imperfective	-	норови'	норови'те	норови'л	норови'ла	норови'ло	норови'ли	норовлю'	норови'шь	норови'т	норови'м	норови'те	норовя'т
сосредоточить	сосредото'чить	concentrate, fix, focus	ansammeln, versammeln, konzentrieren, sich vertiefen	perfective	сосредотачивать,сосредоточивать	сосредото'чь	сосредото'чьте	сосредото'чил	сосредото'чила	сосредото'чило	сосредото'чили	сосредото'чу	сосредото'чишь	сосредото'чит	сосредото'чим	сосредото'чите	сосредото'чат
оформить	офо'рмить	mount, put into shape, get up, design, register officially, legalize, put on the staff	ausgestalten, gestalten; ausstellen, ausfertigen, beantragen, registrieren, legalisieren	perfective	оформлять	офо'рми	офо'рмите	офо'рмил	офо'рмила	офо'рмило	офо'рмили	офо'рмлю	офо'рмишь	офо'рмит	офо'рмим	офо'рмите	офо'рмят
выдумать	вы'думать	invent, make up, concoct, fabricate	ausdenken, erfinden, erdichten, ersinnen	perfective	выдумывать	вы'думай	вы'думайте	вы'думал	вы'думала	вы'думало	вы'думали	вы'думаю	вы'думаешь	вы'думает	вы'думаем	вы'думаете	вы'думают
помниться	по'мниться	remember	sich erinnern	imperfective	запомниться	по'мнись	по'мнитесь	по'мнился	по'мнилась	по'мнилось	по'мнились	по'мнюсь	по'мнишься	по'мнится	по'мнимся	по'мнитесь	по'мнятся
нырнуть	нырну'ть	dive	tauchen, untertauchen	perfective	нырять	нырни'	нырни'те	нырну'л	нырну'ла	нырну'ло	нырну'ли	нырну'	нырнёшь	нырнёт	нырнём	нырнёте	нырну'т
оправдываться	опра'вдываться	justify oneself, come true	sich rechtfertigen; sich als richtig herausstellen, sich erfüllen	imperfective	оправдаться	опра'вдывайся	опра'вдывайтесь	опра'вдывался	опра'вдывалась	опра'вдывалось	опра'вдывались	опра'вдываюсь	опра'вдываешься	опра'вдывается	опра'вдываемся	опра'вдываетесь	опра'вдываются
тыкать	ты'кать	poke, jab, stick, prod, hit, thee and thou, treat with unwanted familiarity	hineinstecken; zeigen	imperfective	ткнуть	ты'кай	ты'кайте	ты'кал	ты'кала	ты'кало	ты'кали	ты'каю	ты'каешь	ты'кает	ты'каем	ты'каете	ты'кают
трещать	треща'ть	crack, crackle, creak, chirr, chatter, jabber, be on the point of collapse	krachen, knistern, zirpen, schwatzen, plappern	imperfective	треснуть	трещи'	трещи'те	треща'л	треща'ла	треща'ло	треща'ли	трещу'	трещи'шь	трещи'т	трещи'м	трещи'те	треща'т
выслать	вы'слать	send, dispatch, banish, exile, deport, expel, send out, push out	abschicken, wegschicken; abschieben (des Landes verweisen), ausweisen, verbannen	perfective	высылать	вы'шли	вы'шлите	вы'слал	вы'слала	вы'слало	вы'слали	вы'шлю	вы'шлешь	вы'шлет	вы'шлем	вы'шлете	вы'шлют
доставлять	доставля'ть	supply, furnish, deliver, convey, cause, give	liefern, bringen, zustellen; verursachen, bereiten	imperfective	доставить	доставля'й	доставля'йте	доставля'л	доставля'ла	доставля'ло	доставля'ли	доставля'ю	доставля'ешь	доставля'ет	доставля'ем	доставля'ете	доставля'ют
оценивать	оце'нивать	fix the price, state the value, value, estimate, appraise, evaluate	einschätzen / beurteilen, würdigen, anerkennen; (wert)schätzen / bewerten	imperfective	оценить	оце'нивай	оце'нивайте	оце'нивал	оце'нивала	оце'нивало	оце'нивали	оце'ниваю	оце'ниваешь	оце'нивает	оце'ниваем	оце'ниваете	оце'нивают
проворчать	проворча'ть	mutter, grumble	knurren, anknurren	perfective	ворчать	проворчи'	проворчи'те	проворча'л	проворча'ла	проворча'ло	проворча'ли	проворчу'	проворчи'шь	проворчи'т	проворчи'м	проворчи'те	проворча'т
