bare	accented	translations_en	translations_de	aspect	partner	imperative_sg	imperative_pl	past_m	past_f	past_n	past_pl	presfut_sg1	presfut_sg2	presfut_sg3	presfut_pl1	presfut_pl2	presfut_pl3
договариваться	догова'риваться	negotiate; agree, arrange matters, make arrangements	abmachen / vereinbaren, sich einigen, übereinkommen; sich verabreden; verhandeln, unterhandeln	imperfective	договориться	догова'ривайся	догова'ривайтесь	догова'ривался	догова'ривалась	догова'ривалось	догова'ривались	догова'риваюсь	догова'риваешься	догова'ривается	догова'риваемся	догова'риваетесь	догова'риваются
расслышать	расслы'шать	catch	hören, vernehmen	perfective	-	расслы'шь	расслы'шьте	расслы'шал	расслы'шала	расслы'шало	расслы'шали	расслы'шу	расслы'шишь	расслы'шит	расслы'шим	расслы'шите	расслы'шат
опередить	опереди'ть	pass ahead, outstrip, take the lead, leave behind, forestall	zuvorkommen, überholen	perfective	опережать	опереди'	опереди'те	опереди'л	опереди'ла	опереди'ло	опереди'ли	опережу'	опереди'шь	опереди'т	опереди'м	опереди'те	опередя'т
перепутать	перепу'тать	confuse	verwirren, durcheinanderbringen, verwechseln	perfective	перепутывать	перепу'тай	перепу'тайте	перепу'тал	перепу'тала	перепу'тало	перепу'тали	перепу'таю	перепу'таешь	перепу'тает	перепу'таем	перепу'таете	перепу'тают
соскучиться	соску'читься	become bored, miss	Langeweile bekommen, sich sehnen	perfective	соскучиваться	соску'чься	соску'чьтесь	соску'чился	соску'чилась	соску'чилось	соску'чились	соску'чусь	соску'шься	соску'чится	соску'чимся	соску'читесь	соску'чатся
копаться	копа'ться	dig, rummage, delve, dawdle	wühlen, kramen, trödeln	imperfective	-	копа'йся	копа'йтесь	копа'лся	копа'лась	копа'лось	копа'лись	копа'юсь	копа'ешься	копа'ется	копа'емся	копа'етесь	копа'ются
грохотать	грохота'ть	crash, roll, peal, rumble, roar, thunder	poltern, krachen, donnern grollen	imperfective	загрохотать	грохочи'	грохочи'те	грохота'л	грохота'ла	грохота'ло	грохота'ли	грохочу'	грохо'чешь	грохо'чет	грохо'чем	грохо'чете	грохо'чут
минуть	ми'нуть	pass	ein bestimmtes Alter erreicht haben	perfective	-			мину'л,ми'нул	мину'ла,ми'нула	мину'ло,ми'нуло	мину'ли,ми'нули	мину'	ми'нешь	ми'нет	ми'нем	ми'нете	ми'нут
расписаться	расписа'ться	sign	unterschreiben, unterzeichnen, standesamtlich heiraten, die Ehe registrieren lassen	perfective	расписываться	распиши'сь	распиши'тесь	расписа'лся	расписа'лась	расписа'лось	расписа'лись	распишу'сь	распи'шешься	распи'шется	распи'шемся	распи'шетесь	распи'шутся
поливать	полива'ть	to water, to soak	gießen, übergießen	imperfective	полить	полива'й	полива'йте	полива'л	полива'ла	полива'ло	полива'ли	полива'ю	полива'ешь	полива'ет	полива'ем	полива'ете	полива'ют
усаживаться	уса'живаться	take a seat, take seats, seat oneself, find a seat, find seats, find room, set	sich niederlassen, Platz nehmen; sich an eine Arbeit machen	imperfective	усесться	уса'живайся	уса'живайтесь	уса'живался	уса'живалась	уса'живалось	уса'живались	уса'живаюсь	уса'живаешься	уса'живается	уса'живаемся	уса'живаетесь	уса'живаются
вериться	ве'риться		glaubhaft sein, sich glauben lassen	imperfective	-
пуститься	пусти'ться		aufbrechen, losgehen	perfective	пускаться	пусти'сь	пусти'тесь	пусти'лся	пусти'лась	пусти'лось	пусти'лись	пущу'сь	пу'стишься	пу'стится	пу'стимся	пу'ститесь	пу'стятся
поменять	поменя'ть	change, exchange	ändern; tauschen, auswechslen	perfective	менять	поменя'й	поменя'йте	поменя'л	поменя'ла	поменя'ло	поменя'ли	поменя'ю	поменя'ешь	поменя'ет	поменя'ем	поменя'ете	поменя'ют
допрашивать	допра'шивать	interrogate, question, examine	verhören, vernehmen; nachbohren / ausquetschen (mit Fragen)	imperfective	допросить	допра'шивай	допра'шивайте	допра'шивал	допра'шивала	допра'шивало	допра'шивали	допра'шиваю	допра'шиваешь	допра'шивает	допра'шиваем	допра'шиваете	допра'шивают
хлопотать	хлопота'ть	bustle about, trouble, solicit, petition, intercede, plead	wirtschaften, geschäftig sein, sich zu schaffen machen, sich bemühen	imperfective	похлопотать,захлопотать	хлопочи'	хлопочи'те	хлопота'л	хлопота'ла	хлопота'ло	хлопота'ли	хлопочу'	хлопо'чешь	хлопо'чет	хлопо'чем	хлопо'чете	хлопо'чут
сосредоточиться	сосредото'читься	concentrate, focus	sich konzentrieren, sich vertiefen; sich ansammeln	perfective	сосредотачиваться,сосредоточиваться	сосредото'чься	сосредото'чьтесь	сосредото'чился	сосредото'чилась	сосредото'чилось	сосредото'чились	сосредото'чусь	сосредото'чишься	сосредото'чится	сосредото'чимся	сосредото'читесь	сосредото'чатся
спастись	спасти'сь		sich retten	perfective	спасаться	спаси'сь	спаси'тесь	спа'сся	спасла'сь	спасло'сь	спасли'сь	спасу'сь	спасёшься	спасётся	спасёмся	спасётесь	спасу'тся
оправдывать	опра'вдывать	justify, warrant, acquit, discharge, excuse	rechtfertigen	imperfective	оправдать	опра'вдывай	опра'вдывайте	опра'вдывал	опра'вдывала	опра'вдывало	опра'вдывали	опра'вдываю	опра'вдываешь	опра'вдывает	опра'вдываем	опра'вдываете	опра'вдывают
отставить	отста'вить	leave, reserve	wegstellen, wegrücken, zur Seite stellen; abspreizen	perfective	отставлять	отста'вь	отста'вьте	отста'вил	отста'вила	отста'вило	отста'вили	отста'влю	отста'вишь	отста'вит	отста'вим	отста'вите	отста'вят
опаздывать	опа'здывать	be late, be overdue	sich verspäten, zu spät kommen, versäumen, verpassen	imperfective	опозда'ть	опа'здывай	опа'здывайте	опа'здывал	опа'здывала	опа'здывало	опа'здывали	опа'здываю	опа'здываешь	опа'здывает	опа'здываем	опа'здываете	опа'здывают
красоваться	красова'ться	appear, show off	sich zur Schau stellen, prunken, prangen	imperfective	-	красу'йся	красу'йтесь	красова'лся	красова'лась	красова'лось	красова'лись	красу'юсь	красу'ешься	красу'ется	красу'емся	красу'етесь	красу'ются
познать	позна'ть	get to know, cognize, become acquainted, experience	erfahren, erleben, durchmachen, └ kennenlernen/kennen lernen┘; erkennen / ergründen, Kenntnisse erwerben, kennenlernen, erfahren	perfective	познавать	позна'й	позна'йте	позна'л	позна'ла	позна'ло	позна'ли	позна'ю	позна'ешь	позна'ет	позна'ем	позна'ете	позна'ют
отдалить	отдали'ть	hold away, remove, postpone, put off, estrange, alienate	entfernen; hinausschieben, hinauszögern	perfective	отдалять	отдали'	отдали'те	отдали'л	отдали'ла	отдали'ло	отдали'ли	отдалю'	отдали'шь	отдали'т	отдали'м	отдали'те	отдаля'т
переодеться	переоде'ться	change clothes; disguise oneself	sich umziehen, sich umkleiden; sich verkleiden	perfective	переодеваться	переоде'нься	переоде'ньтесь	переоде'лся	переоде'лась	переоде'лось	переоде'лись	переоде'нусь	переоде'нешься	переоде'нется	переоде'немся	переоде'нетесь	переоде'нутся
наказывать	нака'зывать	punish, bid, order	bestrafen	imperfective	наказать	нака'зывай	нака'зывайте	нака'зывал	нака'зывала	нака'зывало	нака'зывали	нака'зываю	нака'зываешь	нака'зывает	нака'зываем	нака'зываете	нака'зывают
наделать	наде'лать	give, cause	etw. (eine Weile) machen / anfertigen; etw. anrichten / verursachen	perfective	наделывать	наде'лай	наде'лайте	наде'лал	наде'лала	наде'лало	наде'лали	наде'лаю	наде'лаешь	наде'лает	наде'лаем	наде'лаете	наде'лают
коситься	коси'ться	look sideways, look with an unfavourable eye, look askance	anschielen, von der Seite ansehen	imperfective	покоситься	коси'сь	коси'тесь	коси'лся	коси'лась	коси'лось	коси'лись	кошу'сь	коси'шься	коси'тся	коси'мся	коси'тесь	кося'тся
избавить	изба'вить	save, deliver	retten, befreien	perfective	избавлять	изба'вь	изба'вьте	изба'вил	изба'вила	изба'вило	изба'вили	изба'влю	изба'вишь	изба'вит	изба'вим	изба'вите	изба'вят
увлекаться	увлека'ться	to take an interest in; be carried away, take a great, go mad, take a fancy, be enamoured, fall	sich verlieben; sich begeistern	imperfective	увлечься	увлека'йся	увлека'йтесь	увлека'лся	увлека'лась	увлека'лось	увлека'лись	увлека'юсь	увлека'ешься	увлека'ется	увлека'емся	увлека'етесь	увлека'ются
полюбоваться	полюбова'ться	enjoy; to admire, to feast one's eyes upon for some time	bewundern, bestaunen	perfective	любоваться	полюбу'йся	полюбу'йтесь	полюбова'лся	полюбова'лась	полюбова'лось	полюбова'лись	полюбу'юсь	полюбу'ешься	полюбу'ется	полюбу'емся	полюбу'етесь	полюбу'ются
вертеть	верте'ть	turn	drehen, herumdrehen, jmd. nach Belieben drehen und wenden (umspringen)	imperfective	повертеть	верти'	верти'те	верте'л	верте'ла	верте'ло	верте'ли	верчу'	ве'ртишь	ве'ртит	ве'ртим	ве'ртите	ве'ртят
метнуться	метну'ться		sich hin- und herwerfen, sich wälzen; hin und her rennen	perfective	-	метни'сь	метни'тесь	метну'лся	метну'лась	метну'лось	метну'лись	метну'сь	метнёшься	метнётся	метнёмся	метнётесь	метну'тся
рыть	рыть	dig, burrow, paw, nuzzle, root up, rummage	graben, schaufeln, scharren	imperfective	вырыть,нарыть,подрыть	ро'й	ро'йте	ры'л	ры'ла	ры'ло	ры'ли	ро'ю	ро'ешь	ро'ет	ро'ем	ро'ете	ро'ют
высыпать	вы'сыпать	empty, pour out, spill	ausschütten, verschütten, schütten, streuen, tun, ausschlagen, strömen	perfective	высыпать	вы'сыпь	вы'сыпьте	вы'сыпал	вы'сыпала	вы'сыпало	вы'сыпали	вы'сыплю	вы'сыплешь,вы'сыпешь	вы'сыплет,вы'сыпет	вы'сыплем,вы'сыпем	вы'сыплете,вы'сыпете	вы'сыплют,вы'сыпют
услыхать	услыха'ть		hören, vernehmen, erfahren	perfective				услыха'л	услыха'ла	услыха'ло	услыха'ли
раздобыть	раздобы'ть	procure, get	auftreiben, beschaffen, ergattern	perfective	раздобывать	раздобу'дь	раздобу'дьте	раздобы'л	раздобы'ла	раздобы'ло	раздобы'ли	раздобу'ду	раздобу'дешь	раздобу'дет	раздобу'дем	раздобу'дете	раздобу'дут
трепетать	трепета'ть	tremble, quiver, flicker, thrill, flutter, palpitate	zittern, beben, flackern	imperfective	затрепетать	трепещи'	трепещи'те	трепета'л	трепета'ла	трепета'ло	трепета'ли	трепещу'	трепе'щешь	трепе'щет	трепе'щем	трепе'щете	трепе'щут
осмелиться	осмели'ться	dare	sich trauen, sich erdreisten, sich unterstehen	perfective	осмеливаться	осме'лься	осме'льтесь	осме'лился	осме'лилась	осме'лилось	осме'лились	осме'люсь	осме'лишься	осме'лится	осме'лимся	осме'литесь	осме'лятся
зевнуть	зевну'ть	yawn, gape	gähnen, nicht aufpassen, verpassen	perfective	зевать	зевни'	зевни'те	зевну'л	зевну'ла	зевну'ло	зевну'ли	зевну'	зевнёшь	зевнёт	зевнём	зевнёте	зевну'т
провозгласить	провозгласи'ть	proclaim	verkünden, proklamieren	perfective	провозглашать	провозгласи'	провозгласи'те	провозгласи'л	провозгласи'ла	провозгласи'ло	провозгласи'ли	провозглашу'	провозгласи'шь	провозгласи'т	провозгласи'м	провозгласи'те	провозглася'т
побыть	побы'ть	stay	sich aufhalten (einige Zeit); bleiben (sein, verweilen -> Zustand, Ort)	perfective	-	побу'дь	побу'дьте	побы'л//по'был	побыла'	побы'ло//по'было	побы'ли//по'были	побу'ду	побу'дешь	побу'дет	побу'дем	побу'дете	побу'дут
подымать	подыма'ть		heben, aufheben	imperfective	подъять	подыма'й	подыма'йте	подыма'л	подыма'ла	подыма'ло	подыма'ли	подыма'ю	подыма'ешь	подыма'ет	подыма'ем	подыма'ете	подыма'ют
таиться	таи'ться		verheimlichen, verbergen, verschweigen; sich verbergen, verborgen sein; verborgen liegen	imperfective	-	таи'сь	таи'тесь	таи'лся	таи'лась	таи'лось	таи'лись	таю'сь	таи'шься	таи'тся	таи'мся	таи'тесь	тая'тся
признаваться	признава'ться	confess, admit	gestehen, eingestehen, bekennen, zugeben, enthüllen; zugestehen, anerkennen	imperfective	признаться	признава'йся	признава'йтесь	признава'лся	признава'лась	признава'лось	признава'лись	признаю'сь	признаёшься	признаётся	признаёмся	признаётесь	признаю'тся
улетать	улета'ть	fly, vanish, pass	fortfliegen, wegfliegen, fliegen, abfliegen	imperfective	улететь	улета'й	улета'йте	улета'л	улета'ла	улета'ло	улета'ли	улета'ю	улета'ешь	улета'ет	улета'ем	улета'ете	улета'ют
высунуть	вы'сунуть	put out, thrust out	hinausstrecken, herausstrecken	perfective	высовывать	вы'суни//вы'сунь	вы'суньте	вы'сунул	вы'сунула	вы'сунуло	вы'сунули	вы'суну	вы'сунешь	вы'сунет	вы'сунем	вы'сунете	вы'сунут
сдвинуться	сдви'нуться		sich verschieben, sich in Bewegung setzen, zusammenrücken	perfective	сдвигаться	сдви'нься	сдви'ньтесь	сдви'нулся	сдви'нулась	сдви'нулось	сдви'нулись	сдви'нусь	сдви'нешься	сдви'нется	сдви'немся	сдви'нетесь	сдви'нутся
вытекать	вытека'ть	flow, stream, leak	abfliessen, ablaufen, auslaufen, herauslaufen; resultieren, sich ergeben	imperfective	вытечь	вытека'й	вытека'йте	вытека'л	вытека'ла	вытека'ло	вытека'ли	вытека'ю	вытека'ешь	вытека'ет	вытека'ем	вытека'ете	вытека'ют
рожать	рожа'ть	give birth, bear	entbinden, in den Wehen liegen	imperfective	родить	рожа'й	рожа'йте	рожа'л	рожа'ла	рожа'ло	рожа'ли	рожа'ю	рожа'ешь	рожа'ет	рожа'ем	рожа'ете	рожа'ют
заткнуть	заткну'ть	stop up, plug, stick, thrust	zustopfen, verstopfen, verschließen, zukorken; etwas wohin stopfen	perfective	затыкать	заткни'	заткни'те	заткну'л	заткну'ла	заткну'ло	заткну'ли	заткну'	заткнёшь	заткнёт	заткнём	заткнёте	заткну'т
укладываться	укла'дываться	pack, be packing, go, keep, confine oneself, lie down	sich hinlegen, sich niederlegen; Platz finden, hineinpassen, sich einpacken lassen; sich legen, nachlassen; (seine Sachen) packen; hineinpassen, sich unterbringen lassen, Platz finden; sich in ein Bild / in eine Vorstellungswelt einpassen; entstehen, sich herausbilden; zurechtkommen, es schaffen, einen Termin einhalten	imperfective	уложиться,улечься	укла'дывайся	укла'дывайтесь	укла'дывался	укла'дывалась	укла'дывалось	укла'дывались	укла'дываюсь	укла'дываешься	укла'дывается	укла'дываемся	укла'дываетесь	укла'дываются
отдышаться	отдыша'ться		zu Atem kommen, Atem holen	perfective		отдыши'сь	отдыши'тесь	отдыша'лся	отдыша'лась	отдыша'лось	отдыша'лись	отдышу'сь	отды'шишься	отды'шится	отды'шимся	отды'шитесь	отды'шатся
оборудовать	обору'довать	equip, fit out, manage, arrange	einrichten, ausrüsten, ausstatten	both		обору'дуй	обору'дуйте	обору'довал	обору'довала	обору'довало	обору'довали	обору'дую	обору'дуешь	обору'дует	обору'дуем	обору'дуете	обору'дуют
продвигаться	продвига'ться	advance, move, push, forge ahead	vorrücken, aufrücken	imperfective	продвинуться	продвига'йся	продвига'йтесь	продвига'лся	продвига'лась	продвига'лось	продвига'лись	продвига'юсь	продвига'ешься	продвига'ется	продвига'емся	продвига'етесь	продвига'ются
удрать	удра'ть	make off, run away, bolt	abhauen, ausreissen, sich aus dem Staub machen	perfective	удирать	удери'	удери'те	удра'л	удра'ла	удра'ло	удра'ли	удеру'	удерёшь	удерёт	удерём	удерёте	удеру'т
протестовать	протестова'ть	protest, object, remonstrate, make a protest	protestieren	imperfective	запротестовать	протесту'й	протесту'йте	протестова'л	протестова'ла	протестова'ло	протестова'ли	протесту'ю	протесту'ешь	протесту'ет	протесту'ем	протесту'ете	протесту'ют
грянуть	гря'нуть	burst out, burst forth, break out, strike up	erschallen, ertönen, plötzlich losdonnern (Musik, Lärm etc.)	perfective	-	гря'нь	гря'ньте	гря'нул	гря'нула	гря'нуло	гря'нули	гря'ну	гря'нешь	гря'нет	гря'нем	гря'нете	гря'нут
отвергнуть	отве'ргнуть	reject, turn down, repudiate, vote down	ablehnen, zurückweisen	perfective	отвергать	отве'ргни	отве'ргните	отве'рг//отве'ргнул	отве'ргла	отве'ргло	отве'ргли	отве'ргну	отве'ргнешь	отве'ргнет	отве'ргнем	отве'ргнете	отве'ргнут
увидеться	уви'деться	see each other	sich sehen, sich wiedersehen, sich treffen	perfective	видеться	уви'дься	уви'дьтесь	уви'делся	уви'делась	уви'делось	уви'делись	уви'жусь	уви'дишься	уви'дится	уви'димся	уви'дитесь	уви'дятся
заподозрить	заподо'зрить	suspect, be suspicious	verdächtigen	perfective	подозревать,заподазривать,заподозривать	заподо'зри	заподо'зрите	заподо'зрил	заподо'зрила	заподо'зрило	заподо'зрили	заподо'зрю	заподо'зришь	заподо'зрит	заподо'зрим	заподо'зрите	заподо'зрят
ослабить	осла'бить	weaken, loosen, relax	schwächen, entkräften, mildem, abschwächen, lockern	perfective	ослаблять	осла'бь	осла'бьте	осла'бил	осла'била	осла'било	осла'били	осла'блю	осла'бишь	осла'бит	осла'бим	осла'бите	осла'бят
зацепиться	зацепи'ться		hängenbleiben	perfective	зацепляться,цепляться	зацепи'сь	зацепи'тесь	зацепи'лся	зацепи'лась	зацепи'лось	зацепи'лись	зацеплю'сь	заце'пишься	заце'пится	заце'пимся	заце'питесь	заце'пятся
швырять	швыря'ть	fling, hurl, toss	schleudern, schmeißen, schmettern	imperfective	швырнуть	швыря'й	швыря'йте	швыря'л	швыря'ла	швыря'ло	швыря'ли	швыря'ю	швыря'ешь	швыря'ет	швыря'ем	швыря'ете	швыря'ют
стричь	стричь	cut, clip, shear	schneiden, scheren	imperfective	остричь,постричь	стриги'	стриги'те	стриг	стригла'	стригло'	стригли'	стригу'	стрижёшь	стрижёт	стрижём	стрижёте	стригу'т
умыться	умы'ться	wash oneself	sich waschen	perfective	умываться,мыться	умо'йся	умо'йтесь	умы'лся	умы'лась	умы'лось	умы'лись	умо'юсь	умо'ешься	умо'ется	умо'емся	умо'етесь	умо'ются
расплатиться	расплати'ться	pay off, be quits, get even, reckon, pay	bezahlen, zählen, abrechnen, teuer bezahlen, büßen	perfective	расплачиваться	расплати'сь	расплати'тесь	расплати'лся	расплати'лась	расплати'лось	расплати'лись	расплачу'сь	расплати'шься	расплати'тся	расплати'мся	расплати'тесь	расплатя'тся
передвигаться	передвига'ться	move, shift, travel	sich bewegen	imperfective	передвинуться	передвига'йся	передвига'йтесь	передвига'лся	передвига'лась	передвига'лось	передвига'лись	передвига'юсь	передвига'ешься	передвига'ется	передвига'емся	передвига'етесь	передвига'ются
